{
  "contract": "BA_BIAS_MARKET_BIAS_V2",
  "researchFormat": "MINIMAL_MARKET_RESEARCH_V1",
  "recordId": "bias_070a8219bb661b56ea27538e66dddceb",
  "runId": "audit_live_ogn_v2_source_time_v1",
  "symbol": "OGNUSDT",
  "factsPackageSha256": "4414d91f916b3c59ca4ce1580756cf7f5491ccbf80581e92bbd7ebda9ef6869c",
  "knowledgeRegistrySha256": "ed53b5850d80b501e70c2efcb6e9b64d6b1c33630b6893d71c60a2e827b93896",
  "contextId": "05b0c3e635f76dc0a89e0f966be43a384255ca6d7a51864506984444c338c321",
  "asOf": {
    "factsAsOf": 1791898112558,
    "factsAvailableAt": 1791898114752,
    "factsCollectedAt": 1791898114752,
    "researchRequestedAt": 1791898114777,
    "decisionCompletedAt": 1791898124421,
    "validationCompletedAt": 1791898124423
  },
  "mode": "LIVE",
  "reviewStatus": "PENDING_MANUAL_REVIEW",
  "promptHash": "90b0df5ff5d305a8d2f968b0af7009528519d9dbf10185b19dff18e388ed3aa9",
  "model": "deepseek-flash",
  "modelParameters": {
    "temperature": 0,
    "thinking": {
      "type": "disabled"
    },
    "max_tokens": 8000
  },
  "rawResponse": {
    "id": "a152ac32-4a72-469c-97c5-14fdc5f7c60d",
    "object": "chat.completion",
    "created": 1791898117,
    "model": "deepseek-flash",
    "choices": [
      {
        "index": 0,
        "message": {
          "role": "assistant",
          "content": "{\n  \"marketState\": \"OGNUSDT 永续合约在观察截止时刻（北京时间约21:00）呈现短期剧烈回调但中期仍大幅上涨的状态：滚动24小时价格变化 +14.97%，已收盘24小时变化 +16.96%，但最近已收盘1小时变化 -7.05%、4小时变化 -4.12%，快照最新价 0.03626 USDT 较24小时高点回撤 -16.59%。24小时区间高低幅度达 38.66%，显示极高波动。最近已收盘1小时成交量为前24根均值的 2.18 倍，而最近已收盘5分钟成交量仅为前24根均值的 0.76 倍，短期成交活动在回调后有所降温。持仓方面，24小时OI数量增加 27.74%，但最近1小时OI数量减少 8.92%，4小时OI数量增加 2.34%。资金费率方面，最近一次实际结算（北京时间20:00）为 -0.2058%，过去24小时6次实际结算合计 -0.8429%，空头向多头支付。账户统计显示，全市场净空头账户占比 51.19%，较1小时前下降 4.39 个百分点、较24小时前下降 7.51 个百分点；顶部交易员账户净空头占比 51.30%，较1小时前下降 5.00 个百分点，且已确认由净多主导翻转为净空主导；顶部交易员持仓份额中空方占 49.72%，较24小时前上升 7.68 个百分点。\",\n  \"financialInterpretation\": \"价格在24小时内大幅上涨后出现快速回调，1小时跌幅显著且伴随成交量放大，表明回调期间交易活动活跃，但5分钟成交量低于均值，显示抛压可能已有所释放或市场进入短暂观望。OI数量在24小时内大幅扩张，但最近1小时收缩，结合价格下跌，可能反映部分杠杆头寸退出或平仓，但无法确认是多头平仓还是空头平仓，也不能推断资金流向。负资金费率表明空头向多头支付，反映永续合约相对现货的定价偏空或空头拥挤，但资金费率本身不预测价格方向。全市场账户和顶部交易员账户的净空头占比虽仍略高于50%，但较1小时和24小时前均显著下降，表明空头账户比例在减少，可能因空头平仓或新多头进入；顶部交易员账户由多翻空，但持仓份额上空方仅占49.72%，且账户与持仓口径不同，不能直接推断方向性压力。整体而言，市场处于高波动、短期回调、中期涨幅仍大的状态，多空信号交织，缺乏明确的方向性优势。\",\n  \"supportingEvidence\": [\n    \"OGNUSDT:price.rolling24h 为 +14.97%，OGNUSDT:price.closed24h 为 +16.96%，显示中期价格仍大幅上涨。\",\n    \"OGNUSDT:volume.relative1h 为 2.18，表明最近1小时回调伴随成交量显著高于近期均值，交易活跃。\",\n    \"OGNUSDT:oi.24h 为 +27.74%，显示24小时内未平仓合约数量大幅扩张，市场参与度上升。\",\n    \"OGNUSDT:funding.latest 为 -0.2058%，OGNUSDT:funding.sum24h 为 -0.8429%，负资金费率表明空头向多头支付，空头存在持仓成本。\",\n    \"OGNUSDT:global.short.change1h 为 -4.39 个百分点，OGNUSDT:global.short.change24h 为 -7.51 个百分点，全市场净空头账户占比下降，空头账户减少。\",\n    \"OGNUSDT:topAccounts.short.change1h 为 -5.00 个百分点，顶部交易员净空头账户占比下降。\"\n  ],\n  \"competingEvidence\": [\n    \"OGNUSDT:price.closed1h 为 -7.05%，OGNUSDT:price.closed4h 为 -4.12%，短期价格出现显著回调。\",\n    \"OGNUSDT:price.drawdown 为 -16.59%，快照最新价较24小时高点大幅回撤。\",\n    \"OGNUSDT:oi.1h 为 -8.92%，最近1小时未平仓合约数量收缩，可能反映杠杆退出。\",\n    \"OGNUSDT:volume.relative5m 为 0.76，最近5分钟成交量低于均值，短期交易活跃度下降。\",\n    \"OGNUSDT:topAccounts.flip 为 CONFIRMED，顶部交易员账户主导侧由多翻空，尽管持仓份额上空方仅略占优势。\",\n    \"OGNUSDT:topPositions.short.change24h 为 +7.68 个百分点，顶部交易员持仓份额中空方占比显著上升。\"\n  ],\n  \"decisionBasis\": \"价格中期涨幅大但短期回调剧烈，成交量在1小时放大而5分钟萎缩，OI 24小时扩张但1小时收缩，资金费率为负，账户统计显示空头账户减少但顶部交易员账户翻空且持仓份额空方增加。这些信号相互冲突：中期上涨和负资金费率可能暗示空头压力，但短期价格下跌和OI收缩可能反映多头平仓或去杠杆；账户变化显示空头减少，但顶部交易员翻空和持仓份额空方增加又提供相反线索。由于无法确认具体交易行为（如平仓方向、资金流向），且各时间窗口信号不一致，没有足够证据支持明确的方向性偏差。因此，判断为 NO_EDGE。\",\n  \"bias\": \"NO_EDGE\",\n  \"uncertainties\": [\n    \"无法确认最近1小时OI收缩是由多头平仓、空头平仓还是双向平仓导致，因此不能推断去杠杆的方向性影响。\",\n    \"资金费率负值仅反映支付机制和相对定价，不构成价格方向信号，且其可持续性未知。\",\n    \"账户统计和顶部交易员数据仅反映统计样本的账户方向分布，不代表资金份额、持仓规模或全市场OI的多空占比，不能直接推断价格压力。\",\n    \"顶部交易员账户翻空与持仓份额空方仅略占优势之间存在口径差异，且账户变化可能受样本调整影响，方向性意义有限。\",\n    \"5分钟成交量低于均值可能仅反映短期波动，不代表趋势变化。\",\n    \"缺乏实际强平、大额订单流或资金流向数据，无法验证市场行为的具体驱动。\",\n    \"历史数据在观察截止时刻的可用性未经证明（historicalAvailabilityAtObservationCutoffProven 为 false），但当前事实均标记为 availableBeforeInputFreeze 且 observationCutoffProven，故对当前判断影响有限。\"\n  ]\n}"
        },
        "logprobs": null,
        "finish_reason": "stop"
      }
    ],
    "usage": {
      "prompt_tokens": 15959,
      "completion_tokens": 1493,
      "total_tokens": 17452,
      "prompt_tokens_details": {
        "cached_tokens": 128
      },
      "prompt_cache_hit_tokens": 128,
      "prompt_cache_miss_tokens": 15831
    },
    "system_fingerprint": "aeb56401ca74e127821c4f9126dcb669"
  },
  "rawResponseHash": "58e7c0c7d301cd390711a64dba981b359072e213e7d99ba4bc36725637805d85",
  "executionState": "VALIDATED",
  "analysis": {
    "marketState": "OGNUSDT 永续合约在观察截止时刻（北京时间约21:00）呈现短期剧烈回调但中期仍大幅上涨的状态：滚动24小时价格变化 +14.97%，已收盘24小时变化 +16.96%，但最近已收盘1小时变化 -7.05%、4小时变化 -4.12%，快照最新价 0.03626 USDT 较24小时高点回撤 -16.59%。24小时区间高低幅度达 38.66%，显示极高波动。最近已收盘1小时成交量为前24根均值的 2.18 倍，而最近已收盘5分钟成交量仅为前24根均值的 0.76 倍，短期成交活动在回调后有所降温。持仓方面，24小时OI数量增加 27.74%，但最近1小时OI数量减少 8.92%，4小时OI数量增加 2.34%。资金费率方面，最近一次实际结算（北京时间20:00）为 -0.2058%，过去24小时6次实际结算合计 -0.8429%，空头向多头支付。账户统计显示，全市场净空头账户占比 51.19%，较1小时前下降 4.39 个百分点、较24小时前下降 7.51 个百分点；顶部交易员账户净空头占比 51.30%，较1小时前下降 5.00 个百分点，且已确认由净多主导翻转为净空主导；顶部交易员持仓份额中空方占 49.72%，较24小时前上升 7.68 个百分点。",
    "financialInterpretation": "价格在24小时内大幅上涨后出现快速回调，1小时跌幅显著且伴随成交量放大，表明回调期间交易活动活跃，但5分钟成交量低于均值，显示抛压可能已有所释放或市场进入短暂观望。OI数量在24小时内大幅扩张，但最近1小时收缩，结合价格下跌，可能反映部分杠杆头寸退出或平仓，但无法确认是多头平仓还是空头平仓，也不能推断资金流向。负资金费率表明空头向多头支付，反映永续合约相对现货的定价偏空或空头拥挤，但资金费率本身不预测价格方向。全市场账户和顶部交易员账户的净空头占比虽仍略高于50%，但较1小时和24小时前均显著下降，表明空头账户比例在减少，可能因空头平仓或新多头进入；顶部交易员账户由多翻空，但持仓份额上空方仅占49.72%，且账户与持仓口径不同，不能直接推断方向性压力。整体而言，市场处于高波动、短期回调、中期涨幅仍大的状态，多空信号交织，缺乏明确的方向性优势。",
    "supportingEvidence": [
      "OGNUSDT:price.rolling24h 为 +14.97%，OGNUSDT:price.closed24h 为 +16.96%，显示中期价格仍大幅上涨。",
      "OGNUSDT:volume.relative1h 为 2.18，表明最近1小时回调伴随成交量显著高于近期均值，交易活跃。",
      "OGNUSDT:oi.24h 为 +27.74%，显示24小时内未平仓合约数量大幅扩张，市场参与度上升。",
      "OGNUSDT:funding.latest 为 -0.2058%，OGNUSDT:funding.sum24h 为 -0.8429%，负资金费率表明空头向多头支付，空头存在持仓成本。",
      "OGNUSDT:global.short.change1h 为 -4.39 个百分点，OGNUSDT:global.short.change24h 为 -7.51 个百分点，全市场净空头账户占比下降，空头账户减少。",
      "OGNUSDT:topAccounts.short.change1h 为 -5.00 个百分点，顶部交易员净空头账户占比下降。"
    ],
    "competingEvidence": [
      "OGNUSDT:price.closed1h 为 -7.05%，OGNUSDT:price.closed4h 为 -4.12%，短期价格出现显著回调。",
      "OGNUSDT:price.drawdown 为 -16.59%，快照最新价较24小时高点大幅回撤。",
      "OGNUSDT:oi.1h 为 -8.92%，最近1小时未平仓合约数量收缩，可能反映杠杆退出。",
      "OGNUSDT:volume.relative5m 为 0.76，最近5分钟成交量低于均值，短期交易活跃度下降。",
      "OGNUSDT:topAccounts.flip 为 CONFIRMED，顶部交易员账户主导侧由多翻空，尽管持仓份额上空方仅略占优势。",
      "OGNUSDT:topPositions.short.change24h 为 +7.68 个百分点，顶部交易员持仓份额中空方占比显著上升。"
    ],
    "decisionBasis": "价格中期涨幅大但短期回调剧烈，成交量在1小时放大而5分钟萎缩，OI 24小时扩张但1小时收缩，资金费率为负，账户统计显示空头账户减少但顶部交易员账户翻空且持仓份额空方增加。这些信号相互冲突：中期上涨和负资金费率可能暗示空头压力，但短期价格下跌和OI收缩可能反映多头平仓或去杠杆；账户变化显示空头减少，但顶部交易员翻空和持仓份额空方增加又提供相反线索。由于无法确认具体交易行为（如平仓方向、资金流向），且各时间窗口信号不一致，没有足够证据支持明确的方向性偏差。因此，判断为 NO_EDGE。",
    "bias": "NO_EDGE",
    "uncertainties": [
      "无法确认最近1小时OI收缩是由多头平仓、空头平仓还是双向平仓导致，因此不能推断去杠杆的方向性影响。",
      "资金费率负值仅反映支付机制和相对定价，不构成价格方向信号，且其可持续性未知。",
      "账户统计和顶部交易员数据仅反映统计样本的账户方向分布，不代表资金份额、持仓规模或全市场OI的多空占比，不能直接推断价格压力。",
      "顶部交易员账户翻空与持仓份额空方仅略占优势之间存在口径差异，且账户变化可能受样本调整影响，方向性意义有限。",
      "5分钟成交量低于均值可能仅反映短期波动，不代表趋势变化。",
      "缺乏实际强平、大额订单流或资金流向数据，无法验证市场行为的具体驱动。",
      "历史数据在观察截止时刻的可用性未经证明（historicalAvailabilityAtObservationCutoffProven 为 false），但当前事实均标记为 availableBeforeInputFreeze 且 observationCutoffProven，故对当前判断影响有限。"
    ]
  },
  "dataQuality": {
    "validForResearch": true,
    "unavailableRequiredFactIds": [],
    "unavailableOptionalFactIds": [],
    "sourceAcquisitionTimeUnknownFactIds": [],
    "limitations": [],
    "qualitySource": "RUNNER_VERIFIED_FACTS"
  },
  "error": null
}
